[
  {
    "id": "acme-p1",
    "sku": "acme_001",
    "name": "Acme Co Core Cement",
    "category": "General",
    "price": 420,
    "unit": "bag",
    "image": "product_acme_001.png",
    "tags": ["Core"]
  },
  {
    "id": "acme-p2",
    "sku": "acme_002",
    "name": "Acme Co Premium Cement",
    "category": "Premium",
    "price": 520,
    "unit": "bag",
    "image": "product_acme_002.png",
    "tags": ["Premium"]
  }
]
