[
  {
    "id": "p1",
    "sku": "opc_53",
    "name": "JK Super OPC 53 Grade (50kg)",
    "category": "OPC",
    "price": 420,
    "unit": "bag",
    "image": "product_opc_53.png",
    "tags": [
      "OPC"
    ]
  },
  {
    "id": "p2",
    "sku": "opc_43",
    "name": "JK Super OPC 43 Grade (50kg)",
    "category": "OPC",
    "price": 380,
    "unit": "bag",
    "image": "product_opc_43.png",
    "tags": [
      "OPC"
    ]
  },
  {
    "id": "p3",
    "sku": "ppc",
    "name": "JKSuper Protect PPC (50kg)",
    "category": "PPC",
    "price": 480,
    "unit": "bag",
    "image": "product_ppc.png",
    "tags": [
      "PPC"
    ]
  }
]