[
  {
    "id": "p1",
    "sku": "SUN001",
    "name": "A4 Spiral Book",
    "category": "Notebook",
    "price": 120,
    "unit": "pcs",
    "image": "product_sun001.png",
    "tag": "Stationery"
  },
  {
    "id": "p2",
    "sku": "SUN002",
    "name": "Drawing Book",
    "category": "Notebook",
    "price": 90,
    "unit": "pcs",
    "image": "product_sun002.png",
    "tag": "Stationery"
  },
  {
    "id": "p3",
    "sku": "SUN003",
    "name": "Single Subject Notebook",
    "category": "Notebook",
    "price": 110,
    "unit": "pcs",
    "image": "product_sun003.png",
    "tag": "Stationery"
  },
  {
    "id": "p4",
    "sku": "SUN004",
    "name": "Six Subject Book",
    "category": "Notebook",
    "price": 150,
    "unit": "pcs",
    "image": "product_sun004.png",
    "tag": "Stationery"
  }
]
